{
  "catalog": "c00002",
  "claims": [
    {
      "evidence": [
        {
          "file": "execution/worker/input.json",
          "pointer": "/goal",
          "sha256": "670994b342841fa0b4f55642f5d64c07313fe2f21411fa04d17d34ad0f725f70"
        }
      ],
      "id": "c00001",
      "plane": "agent_record",
      "rule": "copy",
      "value": {
        "clauses": [
          {
            "kind": "Equal",
            "slot": "urn:example:room:s0",
            "unit": "urn:example:room:Celsius",
            "upper": null,
            "value": 22
          }
        ],
        "max_age": 10.0,
        "thing": "urn:example:room:thing"
      }
    },
    {
      "evidence": [
        {
          "file": "execution/worker/discovery.json",
          "pointer": "/0",
          "sha256": "7fd6d47a3504e826f1ace3314db365d400325a6c2d931119f839149aea33aae3"
        }
      ],
      "id": "c00002",
      "plane": "agent_record",
      "rule": "copy",
      "value": {
        "artifact": "urn:example:room:artifact",
        "graph_hash": "323eb81e050f323c61c81843ae3d3367a69987a2cce64fcbe13abe4599265497",
        "identity": "/thing",
        "mutations": "/mutations",
        "observation": "/state",
        "operations": [
          {
            "body": "{\"expected_revision\":null}",
            "echoes": [
              [
                "/temperature",
                "urn:example:room:s0"
              ]
            ],
            "id": "urn:example:room:o0",
            "method": "POST",
            "path": "/heat",
            "request_revision": "/expected_revision",
            "response_revision": "/revision",
            "status": 201
          },
          {
            "body": "{\"expected_revision\":null}",
            "echoes": [
              [
                "/temperature",
                "urn:example:room:s0"
              ]
            ],
            "id": "urn:example:room:o1",
            "method": "POST",
            "path": "/cool",
            "request_revision": "/expected_revision",
            "response_revision": "/revision",
            "status": 201
          }
        ],
        "revision": "/revision",
        "slots": [
          {
            "id": "urn:example:room:s0",
            "kind": "Int",
            "maximum": 26,
            "minimum": 18,
            "pointer": "/temperature",
            "property": "urn:example:room:temperature",
            "unit": "urn:example:room:Celsius"
          },
          {
            "id": "urn:example:room:s1",
            "kind": "Bool",
            "maximum": null,
            "minimum": null,
            "pointer": "/heater_ready",
            "property": "urn:example:room:heater",
            "unit": null
          },
          {
            "id": "urn:example:room:s2",
            "kind": "Bool",
            "maximum": null,
            "minimum": null,
            "pointer": "/cooler_ready",
            "property": "urn:example:room:cooler",
            "unit": null
          },
          {
            "id": "urn:example:room:s3",
            "kind": "JSON",
            "maximum": null,
            "minimum": null,
            "pointer": "/sentinels",
            "property": "urn:example:room:unrelated",
            "unit": null
          }
        ],
        "thing": "urn:example:room:thing",
        "timestamp": "/observed_at",
        "usages": [
          {
            "effects": [
              {
                "kind": "AddInt",
                "slot": "urn:example:room:s0",
                "unit": "urn:example:room:Celsius",
                "value": 1
              }
            ],
            "frame": [
              "urn:example:room:s1",
              "urn:example:room:s2",
              "urn:example:room:s3"
            ],
            "id": "urn:example:room:u0",
            "operation": "urn:example:room:o0",
            "pre": [
              {
                "kind": "Equal",
                "slot": "urn:example:room:s1",
                "unit": null,
                "upper": null,
                "value": true
              },
              {
                "kind": "IntRange",
                "slot": "urn:example:room:s0",
                "unit": "urn:example:room:Celsius",
                "upper": 25,
                "value": 18
              }
            ]
          },
          {
            "effects": [
              {
                "kind": "AddInt",
                "slot": "urn:example:room:s0",
                "unit": "urn:example:room:Celsius",
                "value": -1
              }
            ],
            "frame": [
              "urn:example:room:s1",
              "urn:example:room:s2",
              "urn:example:room:s3"
            ],
            "id": "urn:example:room:u1",
            "operation": "urn:example:room:o1",
            "pre": [
              {
                "kind": "Equal",
                "slot": "urn:example:room:s2",
                "unit": null,
                "upper": null,
                "value": true
              },
              {
                "kind": "IntRange",
                "slot": "urn:example:room:s0",
                "unit": "urn:example:room:Celsius",
                "upper": 26,
                "value": 19
              }
            ]
          }
        ]
      }
    },
    {
      "evidence": [
        {
          "file": "execution/worker/transcript.json",
          "pointer": "/0/turn",
          "sha256": "a66464bb4ae603b83e9019e821fcd16e101e5e2d5fb514a78dae41153ef31e59"
        }
      ],
      "id": "c00003",
      "plane": "agent_record",
      "rule": "copy",
      "value": 1
    },
    {
      "evidence": [
        {
          "file": "execution/worker/transcript.json",
          "pointer": "/0/view/goal_truth",
          "sha256": "a66464bb4ae603b83e9019e821fcd16e101e5e2d5fb514a78dae41153ef31e59"
        }
      ],
      "id": "c00004",
      "plane": "agent_record",
      "rule": "copy",
      "value": "UNKNOWN"
    },
    {
      "evidence": [
        {
          "file": "execution/worker/transcript.json",
          "pointer": "/0/proposal",
          "sha256": "a66464bb4ae603b83e9019e821fcd16e101e5e2d5fb514a78dae41153ef31e59"
        }
      ],
      "id": "c00005",
      "plane": "agent_record",
      "rule": "copy",
      "value": {
        "handle": null,
        "snapshot_ref": null,
        "tool": "discover"
      }
    },
    {
      "evidence": [
        {
          "file": "execution/worker/transcript.json",
          "pointer": "/0/feedback",
          "sha256": "a66464bb4ae603b83e9019e821fcd16e101e5e2d5fb514a78dae41153ef31e59"
        }
      ],
      "id": "c00006",
      "plane": "runtime_observation",
      "rule": "copy",
      "value": {
        "code": "DISCOVERED"
      }
    },
    {
      "evidence": [
        {
          "file": "execution/worker/transcript.json",
          "pointer": "/1/turn",
          "sha256": "a66464bb4ae603b83e9019e821fcd16e101e5e2d5fb514a78dae41153ef31e59"
        }
      ],
      "id": "c00007",
      "plane": "agent_record",
      "rule": "copy",
      "value": 2
    },
    {
      "evidence": [
        {
          "file": "execution/worker/transcript.json",
          "pointer": "/1/view/goal_truth",
          "sha256": "a66464bb4ae603b83e9019e821fcd16e101e5e2d5fb514a78dae41153ef31e59"
        }
      ],
      "id": "c00008",
      "plane": "agent_record",
      "rule": "copy",
      "value": "UNKNOWN"
    },
    {
      "evidence": [
        {
          "file": "execution/worker/transcript.json",
          "pointer": "/1/proposal",
          "sha256": "a66464bb4ae603b83e9019e821fcd16e101e5e2d5fb514a78dae41153ef31e59"
        }
      ],
      "id": "c00009",
      "plane": "agent_record",
      "rule": "copy",
      "value": {
        "handle": null,
        "snapshot_ref": null,
        "tool": "observe"
      }
    },
    {
      "evidence": [
        {
          "file": "execution/worker/transcript.json",
          "pointer": "/1/feedback",
          "sha256": "a66464bb4ae603b83e9019e821fcd16e101e5e2d5fb514a78dae41153ef31e59"
        }
      ],
      "id": "c00010",
      "plane": "runtime_observation",
      "rule": "copy",
      "value": {
        "code": "OBSERVED",
        "context": {
          "id": "urn:context:80b0f545-c7e0-42cc-b481-7667d20d275f",
          "mutations": 0,
          "observed_at": "2026-10-29T16:42:01.713853+00:00",
          "raw": "{\"cooler_ready\":true,\"heater_ready\":true,\"mutations\":0,\"observed_at\":\"2026-10-29T16:42:01.713853+00:00\",\"pending_requests\":0,\"requests\":0,\"revision\":0,\"sentinels\":{\"lamp\":\"off\",\"marker\":{\"untouched\":true}},\"temperature\":23,\"thing\":\"urn:example:room:thing\"}",
          "revision": 0,
          "thing": "urn:example:room:thing",
          "values": [
            [
              "urn:example:room:s0",
              23
            ],
            [
              "urn:example:room:s1",
              true
            ],
            [
              "urn:example:room:s2",
              true
            ],
            [
              "urn:example:room:s3",
              "{\"lamp\":\"off\",\"marker\":{\"untouched\":true}}"
            ]
          ]
        }
      }
    },
    {
      "evidence": [
        {
          "file": "execution/worker/transcript.json",
          "pointer": "/2/turn",
          "sha256": "a66464bb4ae603b83e9019e821fcd16e101e5e2d5fb514a78dae41153ef31e59"
        }
      ],
      "id": "c00011",
      "plane": "agent_record",
      "rule": "copy",
      "value": 3
    },
    {
      "evidence": [
        {
          "file": "execution/worker/transcript.json",
          "pointer": "/2/view/context",
          "sha256": "a66464bb4ae603b83e9019e821fcd16e101e5e2d5fb514a78dae41153ef31e59"
        }
      ],
      "id": "c00012",
      "plane": "agent_record",
      "rule": "copy",
      "value": {
        "id": "urn:context:80b0f545-c7e0-42cc-b481-7667d20d275f",
        "mutations": 0,